{
  "schema": "locaily.development.project_state.v1",
  "project": "locaily",
  "currentMilestone": null,
  "activeSession": null,
  "status": "idle",
  "defaultBranch": "main",
  "activeBranch": "milestone/core-04-complete-generic-matrix-qualification",
  "lastCompletedMilestone": "core-04-complete-generic-matrix-qualification",
  "nextRecommendedAction": "Milestone 'core-04-complete-generic-matrix-qualification' merged. Run dev:dashboard to refresh.",
  "blockers": [],
  "warnings": [],
  "updatedAt": "2026-10-01T04:39:01.161Z",
  "updatedBy": {
    "type": "agent",
    "name": "dev-lifecycle",
    "platform": "system"
  },
  "mergedMilestone": "core-04-complete-generic-matrix-qualification",
  "mergedAt": "2026-10-01T04:39:01.161Z",
  "mergedCommit": "effb0b7d5cf5b7b35eaf1642d40568d9243694d3"
}
